{
  "$schema": "https://json-schema.org/draft/2020-12/schema",
  "title": "ValidationFixture",
  "type": "object",
  "properties": {
    "simulator": { "type": "string" },
    "input": { "type": "object", "additionalProperties": true },
    "legacy_output": { "type": "object", "additionalProperties": true },
    "external_output": { "type": "object", "additionalProperties": true },
    "tolerance": {
      "type": "object",
      "properties": {
        "currency_abs": { "type": "number", "default": 0.01 },
        "percent_abs": { "type": "number", "default": 0.01 },
        "relative": { "type": "number", "default": 0.0005 }
      },
      "required": ["currency_abs", "percent_abs", "relative"]
    }
  },
  "required": ["simulator", "input", "tolerance"]
}
